productType,variantId,sku,prices,tax,categories,images,name.en,description.en,slug.en,metaTitle.en,metaDescription.en,name.en-us,description.en-us,slug.en-us,metaTitle.en-us,metaDescription.en-us,metaKeywords.en,size,amount
ecommerce2024rss_spray,1,Spray_2,EUR 600,standard,Gadget>Spray,https://raw.githubusercontent.com/belosnezhie/eCommerce-Application-data/main/images/Gadgets/sprays/feey-OYfQdJ3xQAc-unsplash.jpg,,,,,,Aqua Bloom,"A versatile water spray designed to keep your indoor plants hydrated and thriving. With its gentle misting action, it provides the perfect level of moisture to your plants' leaves and soil.",aqua_bloom,,,,,
ecommerce2024rss_spray,1,Spray_3,EUR 1000,standard,Gadget>Spray,https://raw.githubusercontent.com/belosnezhie/eCommerce-Application-data/main/images/Gadgets/sprays/lucas-van-oort-MHrmbMQ8DJ8-unsplash.jpg,,,,,,Flora Spritz,"A convenient and effective mister designed for nurturing your indoor plants. Its fine mist gently hydrates leaves and soil, providing essential moisture for healthy growth.",flora_spritz,,,,,
ecommerce2024rss_can,1,Can_1,EUR 1000,standard,Gadget>Can,https://raw.githubusercontent.com/belosnezhie/eCommerce-Application-data/main/images/Gadgets/watering-cans/feey-k3jEtUmKhJo-unsplash.jpg,,,,,,Sunburst,Sunburst combines functionality with style in this vibrant watering can designed for home plants. Its sleek design adds a touch of modern elegance to your routine.,sunburst,,,,,
ecommerce2024rss_can,1,Can_2,EUR 15000,standard,Gadget>Can,https://raw.githubusercontent.com/belosnezhie/eCommerce-Application-data/main/images/Gadgets/watering-cans/hitomi-bremmer-WrR6KiGA3bo-unsplash.jpg,,,,,,Chic Pour,"  The epitome of style and functionality in watering cans for home plants. Its sleek and modern design adds a touch of elegance to your indoor gardening space. ",chic_pour,,,,,
ecommerce2024rss_can,1,Can_3,EUR 1800,standard,Gadget>Can,https://raw.githubusercontent.com/belosnezhie/eCommerce-Application-data/main/images/Gadgets/watering-cans/kara-eads-X8X5l0BDPk0-unsplash.jpg,,,,,,Bloom Flow,"  BloomFlow offers a blend of elegance and practicality in a watering can designed for home plants. Its graceful curves and refined design make it a stylish addition to any indoor garden.",bloom_flow,,,,,
